{
  "$schema": "../schemas/schema_trilha_aprendizado.json",
  "produto_foco": "Postfix + Dovecot",
  "slug": "postfix-dovecot",
  "saas_origem": "Gmail, Microsoft 365, Zoho Mail",
  "tempo_total_estimado": "5 horas de imersao guiada (No seu proprio ritmo)",
  "fases": [
    {
      "fase_numero": 1,
      "titulo": "Fase 1: Conceitos Email, SMTP/IMAP & Soberania",
      "tempo_estimado": "1h 00min",
      "objetivo": "Entender protocolos email e beneficios privacidade",
      "recursos": [
        {
          "titulo": "Protocolos Email: SMTP, IMAP, POP3",
          "tipo_midia": "Artigo Tecnico",
          "idioma": "PT-BR",
          "dica_traducao_ptbr": "100% PT-BR",
          "autor": "Linux Admins Brasil",
          "duracao": "25 min",
          "url": "https://www.digitalocean.com/community/tutorials/understanding-the-smtp-protocol",
          "aprendizado_chave": "Diferencas SMTP/IMAP/POP3. IMAP mais seguro.",
          "fonte_id": "F01"
        },
        {
          "titulo": "LGPD Servers Email Proprios",
          "tipo_midia": "Guia Legal",
          "idioma": "PT-BR",
          "dica_traducao_ptbr": "PT-BR",
          "autor": "Tech Law Advogado",
          "duracao": "20 min",
          "url": "https://www.gov.br/cidadania/pt-br/acesso-a-informacao/lgpd",
          "aprendizado_chave": "Responsabilidades legais",
          "fonte_id": "F02"
        },
        {
          "titulo": "SSL/TLS Seguranca Email",
          "tipo_midia": "Documentacao Tecnica",
          "idioma": "EN",
          "dica_traducao_ptbr": "Auto-translate browser",
          "autor": "Let's Encrypt",
          "duracao": "15 min",
          "url": "https://letsencrypt.org/how-it-works/",
          "aprendizado_chave": "SSL protege transito",
          "fonte_id": "F03"
        }
      ]
    },
    {
      "fase_numero": 2,
      "titulo": "Fase 2: Instalacao VPS, Linux Basics",
      "tempo_estimado": "1h 30min",
      "objetivo": "Tutorial instalacao Postfix+Dovecot",
      "recursos": [
        {
          "titulo": "VPS Hetzner Iniciantes",
          "tipo_midia": "Tutorial",
          "idioma": "PT-BR",
          "dica_traducao_ptbr": "PT-BR leigos",
          "autor": "DevOps Brasil",
          "duracao": "30 min",
          "url": "https://docs.hetzner.cloud/basics/getting-started/",
          "aprendizado_chave": "Criar conta, VPS, SSH",
          "fonte_id": "F04"
        },
        {
          "titulo": "Postfix+Dovecot Instalacao",
          "tipo_midia": "Guia Tecnico",
          "idioma": "PT-BR",
          "dica_traducao_ptbr": "Screenshots PT-BR",
          "autor": "Linux Admins",
          "duracao": "40min+20min",
          "url": "https://www.linuxbabe.com/mail-server/postfix-dovecot-ubuntu",
          "aprendizado_chave": "apt, systemctl, nano",
          "fonte_id": "F01"
        },
        {
          "titulo": "SSL Let's Encrypt",
          "tipo_midia": "Tutorial",
          "idioma": "EN",
          "dica_traducao_ptbr": "Visual",
          "autor": "Certbot",
          "duracao": "20 min",
          "url": "https://certbot.eff.org/instructions/ubuntu-20.04/",
          "aprendizado_chave": "Certificados auto",
          "fonte_id": "F03"
        }
      ]
    },
    {
      "fase_numero": 3,
      "titulo": "Fase 3: SPF, DKIM, DMARC Config",
      "tempo_estimado": "1h 15min",
      "objetivo": "Anti-spam assinaturas digitais",
      "recursos": [
        {
          "titulo": "SPF DKIM DMARC Explicado",
          "tipo_midia": "Artigo",
          "idioma": "PT-BR",
          "dica_traducao_ptbr": "PT-BR exemplos",
          "autor": "Seguranca Email",
          "duracao": "30 min",
          "url": "https://www.sitehosting.com.br/blog/spf-dkim-dmarc/",
          "aprendizado_chave": "Diferencas SPF/DKIM/DMARC",
          "fonte_id": "F02"
        },
        {
          "titulo": "Implementar SPF DKIM DMARC",
          "tipo_midia": "Guia Tecnico",
          "idioma": "EN",
          "dica_traducao_ptbr": "Copy comandos",
          "autor": "Linux Babe",
          "duracao": "45 min",
          "url": "https://www.linuxbabe.com/mail-server/opendkim-ubuntu-postfix",
          "aprendizado_chave": "opendkim-genkey, DNS",
          "fonte_id": "F04"
        },
        {
          "titulo": "Email Tester MXToolbox",
          "tipo_midia": "Ferramenta",
          "idioma": "EN",
          "dica_traducao_ptbr": "Visual",
          "autor": "MXToolbox",
          "duracao": "15 min",
          "url": "https://mxtoolbox.com/",
          "aprendizado_chave": "Validar SPF/DKIM/DMARC",
          "fonte_id": "F05"
        }
      ]
    },
    {
      "fase_numero": 4,
      "titulo": "Fase 4: Clientes Email Dovecot",
      "tempo_estimado": "1h 00min",
      "objetivo": "Thunderbird Outlook Apple Mail",
      "recursos": [
        {
          "titulo": "Thunderbird IMAP Config",
          "tipo_midia": "Tutorial",
          "idioma": "PT-BR",
          "dica_traducao_ptbr": "Screenshots PT-BR",
          "autor": "Mozilla Brasil",
          "duracao": "20 min",
          "url": "https://support.mozilla.org/pt-BR/kb/configurar-sua-conta-de-email",
          "aprendizado_chave": "Port 993 SSL sync",
          "fonte_id": "F01"
        },
        {
          "titulo": "Outlook IMAP Config",
          "tipo_midia": "Oficial",
          "idioma": "PT-BR",
          "dica_traducao_ptbr": "PT-BR oficial",
          "autor": "Microsoft",
          "duracao": "15 min",
          "url": "https://support.microsoft.com/pt-br/office/criar-um-perfil-novo-do-outlook",
          "aprendizado_chave": "SMTP 587 STARTTLS",
          "fonte_id": "F02"
        },
        {
          "titulo": "Filtros Regras Avancadas",
          "tipo_midia": "Docs",
          "idioma": "EN",
          "dica_traducao_ptbr": "Visual",
          "autor": "Thunderbird",
          "duracao": "25 min",
          "url": "https://support.mozilla.org/en-US/kb/creating-and-using-filters",
          "aprendizado_chave": "Automacao backup offline",
          "fonte_id": "F03"
        }
      ]
    },
    {
      "fase_numero": 5,
      "titulo": "Fase 5: Troubleshooting Manutencao",
      "tempo_estimado": "1h 15min",
      "objetivo": "Diagnostico escalabilidade",
      "recursos": [
        {
          "titulo": "Diagnostico SMTP/IMAP Problemas",
          "tipo_midia": "Guia",
          "idioma": "PT-BR",
          "dica_traducao_ptbr": "Logs PT-BR",
          "autor": "Linux Admins",
          "duracao": "25 min",
          "url": "https://www.linuxbabe.com/mail-server/postfix-dovecot-ubuntu",
          "aprendizado_chave": "/var/log/mail.log mailq telnet",
          "fonte_id": "F04"
        },
        {
          "titulo": "Monitoramento Tempo Real",
          "tipo_midia": "Tutorial",
          "idioma": "EN",
          "dica_traducao_ptbr": "Copy scripts",
          "autor": "Linux Admins",
          "duracao": "20 min",
          "url": "https://www.digitalocean.com/community/tutorials/how-to-use-journalctl-to-view-and-manipulate-systemd-logs",
          "aprendizado_chave": "systemctl journalctl htop",
          "fonte_id": "F01"
        },
        {
          "titulo": "Multiplos Usuarios Quotas",
          "tipo_midia": "Guia",
          "idioma": "EN",
          "dica_traducao_ptbr": "Config universal",
          "autor": "Dovecot",
          "duracao": "30 min",
          "url": "https://doc.dovecot.org/configuration_manual/quota/",
          "aprendizado_chave": "Quotas doveadm limites",
          "fonte_id": "F02"
        },
        {
          "titulo": "Backup Redundancia HA",
          "tipo_midia": "Arquitetural",
          "idioma": "EN",
          "dica_traducao_ptbr": "Conceitos universais",
          "autor": "HA Systems",
          "duracao": "20 min",
          "url": "https://www.linuxbabe.com/mail-server/backup-postfix-dovecot",
          "aprendizado_chave": "Backup replicacao failover",
          "fonte_id": "F05"
        }
      ]
    }
  ]
}