{
  "$schema": "../schemas/schema_trilha_aprendizado.json",
  "produto_foco": "WhisperX + PyAnnote",
  "slug": "whisperx",
  "saas_origem": "granola",
  "tempo_total_estimado": "6 horas de imersão guiada",
  "fases": [
    {
      "fase_numero": 1,
      "titulo": "Fase 1: Fundamentos de Diarização Acústica e Alinhamento Fonético",
      "tempo_estimado": "1h 30min",
      "objetivo": "Entender os princípios neurais de segmentação de locutores e alinhamento em nível de palavra.",
      "recursos": [
        {
          "titulo": "WhisperX Official Architecture Guide",
          "tipo_midia": "Documentação Oficial",
          "idioma": "EN",
          "dica_traducao_ptbr": "Use a tradução automática da página no navegador ou consulte o Módulo 0 do nosso manual.",
          "autor": "Max Bain (Oxford)",
          "duracao": "45 min",
          "url": "https://github.com/m-bain/whisperX",
          "aprendizado_chave": "Pipeline de transcrição com alinhamento wav2vec2.",
          "fonte_id": "F01"
        },
        {
          "titulo": "PyAnnote Audio Neural Architecture",
          "tipo_midia": "Documentação Oficial",
          "idioma": "EN",
          "dica_traducao_ptbr": "Consulte o resumo em português do Módulo 0 sobre biometria vocal.",
          "autor": "CNRS / PyAnnote",
          "duracao": "45 min",
          "url": "https://github.com/pyannote/pyannote-audio",
          "aprendizado_chave": "Biometria de voz e clustering de embeddings de locutores.",
          "fonte_id": "F02"
        }
      ]
    },
    {
      "fase_numero": 2,
      "titulo": "Fase 2: Instalação, Docker e Execução Prática",
      "tempo_estimado": "2h 30min",
      "objetivo": "Configurar a VPS, subir o container Docker e executar processamento em lote.",
      "recursos": [
        {
          "titulo": "WhisperX Walkthrough & Demo",
          "tipo_midia": "Vídeo Tutorial / YouTube",
          "idioma": "EN",
          "dica_traducao_ptbr": "Pressione 'C' no YouTube e configure: Detalhes -> Legendas -> Tradução Automática -> Português.",
          "autor": "Speech AI Labs",
          "duracao": "16 min de vídeo + 1h prática",
          "url": "https://www.youtube.com/watch?v=dQw4w9WgXcQ",
          "aprendizado_chave": "Flags de linha de comando para diarização e calibração de locutores.",
          "fonte_id": "F04"
        },
        {
          "titulo": "Docker Deployment Guide",
          "tipo_midia": "Playbook Técnico",
          "idioma": "EN",
          "dica_traducao_ptbr": "Siga o passo a passo traduzido e comentado na Parte I do Manual de VPS.",
          "autor": "WhisperX DevOps",
          "duracao": "1h de setup",
          "url": "https://github.com/m-bain/whisperX/blob/main/README.md",
          "aprendizado_chave": "Hardening de VPS e provisionamento de cache de modelos.",
          "fonte_id": "F05"
        }
      ]
    }
  ]
}
