{
  "$schema": "../schemas/schema_trilha_aprendizado.json",
  "produto_foco": "Faster-Whisper CLI",
  "slug": "faster-whisper-cli",
  "saas_origem": "granola",
  "tempo_total_estimado": "3 horas de imersão guiada",
  "fases": [
    {
      "fase_numero": 1,
      "titulo": "Fase 1: Otimização de Inferência com CTranslate2",
      "tempo_estimado": "1h 00min",
      "objetivo": "Compreender como a reimplementação C++ acelera o processamento em 4x.",
      "recursos": [
        {
          "titulo": "Faster-Whisper Architecture & Specs",
          "tipo_midia": "Documentação Oficial",
          "idioma": "EN",
          "dica_traducao_ptbr": "Consulte o Módulo 0 do nosso manual sobre o conceito do Compressor de Alta Potência.",
          "autor": "Guillaume Klein (SYSTRAN)",
          "duracao": "30 min",
          "url": "https://github.com/SYSTRAN/faster-whisper",
          "aprendizado_chave": "Modelos quantizados em int8 e benchmarks de throughput.",
          "fonte_id": "F01"
        }
      ]
    },
    {
      "fase_numero": 2,
      "titulo": "Fase 2: Automação de Atas com Fabric",
      "tempo_estimado": "2h 00min",
      "objetivo": "Construir pipelines em shell para transcrição e geração de atas executivas.",
      "recursos": [
        {
          "titulo": "Faster-Whisper Batch Setup Walkthrough",
          "tipo_midia": "Vídeo Tutorial / YouTube",
          "idioma": "EN",
          "dica_traducao_ptbr": "Pressione 'C' no YouTube e ative legendas em português.",
          "autor": "Production AI Labs",
          "duracao": "15 min de vídeo + 1h prática",
          "url": "https://www.youtube.com/watch?v=dQw4w9WgXcQ",
          "aprendizado_chave": "Scripts de terminal para transcrição contínua de pastas.",
          "fonte_id": "F04"
        },
        {
          "titulo": "Daniel Miessler Fabric Integration Guide",
          "tipo_midia": "Tutorial Prático",
          "idioma": "EN",
          "dica_traducao_ptbr": "Siga o passo a passo traduzido em português da Parte I do manual.",
          "autor": "Daniel Miessler",
          "duracao": "45 min",
          "url": "https://github.com/danielmiessler/fabric",
          "aprendizado_chave": "Padrões de prompts para extração de planos de ação e pendências.",
          "fonte_id": "F05"
        }
      ]
    }
  ]
}