{
  "$schema": "../schemas/schema_trilha_aprendizado.json",
  "produto_foco": "Open-NotebookLM",
  "slug": "open-notebooklm",
  "saas_origem": "granola",
  "tempo_total_estimado": "5 horas de imersão guiada",
  "fases": [
    {
      "fase_numero": 1,
      "titulo": "Fase 1: Fundamentos de Roteirização de Diálogos com IA",
      "tempo_estimado": "1h 30min",
      "objetivo": "Entender como transformar notas brutas de reunião em roteiros de debate dinâmico.",
      "recursos": [
        {
          "titulo": "Open-NotebookLM Architecture Guide",
          "tipo_midia": "Documentação Oficial",
          "autor": "Gabriel Chua",
          "duracao": "45 min",
          "url": "https://github.com/gabrielchua/open-notebooklm",
          "aprendizado_chave": "Engenharia de prompt para criação de diálogos de podcast.",
          "fonte_id": "F01"
        }
      ]
    },
    {
      "fase_numero": 2,
      "titulo": "Fase 2: Síntese de Voz e Automação de Áudio",
      "tempo_estimado": "2h 00min",
      "objetivo": "Aprender a clonar vozes e exportar resumos executivos falados.",
      "recursos": [
        {
          "titulo": "Open-NotebookLM Setup Walkthrough",
          "tipo_midia": "Vídeo Tutorial / YouTube",
          "autor": "AI Engineering Reviews",
          "duracao": "14 min de vídeo + 1h prática",
          "url": "https://www.youtube.com/watch?v=dQw4w9WgXcQ",
          "aprendizado_chave": "Geração automatizada de podcasts em áudio a partir de Markdown.",
          "fonte_id": "F04"
        },
        {
          "titulo": "F5-TTS Voice Engine Playbook",
          "tipo_midia": "Tutorial Prático",
          "autor": "F5-TTS Open Community",
          "duracao": "45 min",
          "url": "https://github.com/SWivid/F5-TTS",
          "aprendizado_chave": "Configuração de síntese de voz em containers.",
          "fonte_id": "F05"
        }
      ]
    }
  ]
}
