{
  "$schema": "../schemas/schema_trilha_aprendizado.json",
  "produto_foco": "Mailu",
  "slug": "mailu",
  "saas_origem": "locaweb-email",
  "tempo_total_estimado": "8 horas de imersão guiada (No seu próprio ritmo)",
  "fases": [
    {
      "fase_numero": 1,
      "titulo": "Fase 1: Email, Privacidade & Soberania Corporativa (Brasil First)",
      "tempo_estimado": "1h 30min",
      "objetivo": "Entender por que hosting próprio de email é crucial para empresas brasileiras sob LGPD, como funciona a federação de email na internet e os riscos de depender de Locaweb ou terceiros.",
      "recursos": [
        {
          "titulo": "LGPD, Privacidade de Dados Corporativos e Riscos de Cloud Estrangeira",
          "tipo_midia": "Artigo Técnico / Guia Aberto",
          "idioma": "PT-BR",
          "dica_traducao_ptbr": "Conteúdo 100% nativo em Português do Brasil.",
          "autor": "Comunidade Brasileira de Privacidade & Compliance",
          "duracao": "45 min de leitura",
          "url": "https://www.gov.br/cidadania/pt-br/acesso-a-informacao/lgpd",
          "aprendizado_chave": "Diferenças entre armazenar emails em Microsoft 365 (EUA) vs Locaweb (Brasil) vs Mailu (seu próprio servidor). Controle jurisdicional absoluto.",
          "fonte_id": "F05"
        },
        {
          "titulo": "Visão Geral da Arquitetura de Servidores de Email & Protocolo SMTP",
          "tipo_midia": "Documentação Oficial",
          "idioma": "PT-BR",
          "dica_traducao_ptbr": "Excelente recurso em português explicando a federação de email.",
          "autor": "Mailu Documentation & SMTP RFC 5321",
          "duracao": "45 min de leitura assistida",
          "url": "https://mailu.io/latest/",
          "aprendizado_chave": "Como emails viajam pela internet de servidor para servidor, como SPF/DKIM/DMARC protegem contra falsificação.",
          "fonte_id": "F01"
        }
      ]
    },
    {
      "fase_numero": 2,
      "titulo": "Fase 2: Preparação de Domínio, DNS e Certificados SSL",
      "tempo_estimado": "1h 45min",
      "objetivo": "Aprender a registrar domínios, configurar registros DNS (MX, A, SPF, DKIM, DMARC) e gerar certificados SSL com Let's Encrypt para produção.",
      "recursos": [
        {
          "titulo": "Como Comprar Domínio e Gerenciar Registros DNS",
          "tipo_midia": "Guia Prático / Tutorial",
          "idioma": "PT-BR",
          "dica_traducao_ptbr": "Passo a passo didático em português para criar domínio com Registro.br ou GoDaddy.",
          "autor": "Comunidade Brasileira de Infraestrutura",
          "duracao": "45 min de estudo",
          "url": "https://www.registro.br/",
          "aprendizado_chave": "Registros A (IP do servidor), MX (servidor de email), TXT (SPF/DKIM/DMARC), CNAME (aliases).",
          "fonte_id": "F02"
        },
        {
          "titulo": "SPF, DKIM e DMARC: Assinando seus Emails com Confiança",
          "tipo_midia": "Código & Playbook",
          "idioma": "EN",
          "dica_traducao_ptbr": "Use tradução automática do navegador. O manual Mailu em português cobre tudo isso na Seção II.",
          "autor": "Mailu Core & DMARC.org",
          "duracao": "1h de prática guiada",
          "url": "https://mailu.io/latest/configuration/settings/",
          "aprendizado_chave": "Geração de chaves DKIM, configuração de política SPF no DNS, monitoramento de rejeições com DMARC.",
          "fonte_id": "F05"
        }
      ]
    },
    {
      "fase_numero": 3,
      "titulo": "Fase 3: Instalação em VPS & Primeiros Passos com Docker",
      "tempo_estimado": "2h",
      "objetivo": "Alugar uma VPS (Hetzner, Contabo), instalar Mailu via Docker Compose e colocar o servidor de email no ar.",
      "recursos": [
        {
          "titulo": "Como Alugar uma VPS Europeia (Hetzner) e Conectar via SSH",
          "tipo_midia": "Guia Prático / Tutorial",
          "idioma": "PT-BR",
          "dica_traducao_ptbr": "Passo a passo em português: criar conta, escolher VPS, receber IP e conectar.",
          "autor": "Comunidade DevOps Brasil",
          "duracao": "30 min de estudo",
          "url": "https://www.hetzner.com/cloud",
          "aprendizado_chave": "Seleção de VPS ideal (CPX21 com 2 vCPU, 4 GB RAM, 80 GB SSD), primeiro acesso SSH, mudança de senha root.",
          "fonte_id": "F02"
        },
        {
          "titulo": "Hardening de Servidor Linux & Instalação de Docker",
          "tipo_midia": "Guia Técnico",
          "idioma": "EN",
          "dica_traducao_ptbr": "Consulte a Seção I do Manual Mailu em Português para comandos prontos.",
          "autor": "Ubuntu Security Guides & Docker Official",
          "duracao": "45 min de prática",
          "url": "https://docs.docker.com/install/linux/docker-ce/ubuntu/",
          "aprendizado_chave": "Atualização de pacotes, criação de usuário non-root, firewall UFW, instalação de Docker Engine.",
          "fonte_id": "F02"
        },
        {
          "titulo": "Deploy de Mailu via Docker Compose & Configuração Inicial",
          "tipo_midia": "Tutorial Prático",
          "idioma": "PT-BR",
          "dica_traducao_ptbr": "O setup.py interativo guia você passo a passo em português.",
          "autor": "Mailu Setup Wizard",
          "duracao": "45 min de prática",
          "url": "https://github.com/Mailu/Mailu/blob/master/setup.py",
          "aprendizado_chave": "Clone do repo GitHub, execução do setup.py, geração de docker-compose.yml configurado.",
          "fonte_id": "F01"
        }
      ]
    },
    {
      "fase_numero": 4,
      "titulo": "Fase 4: Configuração de Usuários, Clientes de Email e Testagem",
      "tempo_estimado": "1h 30min",
      "objetivo": "Criar usuários no painel Mailu, configurar Thunderbird/Outlook/iPhone para acessar remotamente e enviar emails de teste.",
      "recursos": [
        {
          "titulo": "Painel de Administração Mailu: Criar Usuários, Aliases e Domínios",
          "tipo_midia": "Tutorial Prático",
          "idioma": "PT-BR",
          "dica_traducao_ptbr": "Interface admin em português. Passo a passo visual para cada tarefa.",
          "autor": "Mailu Documentation",
          "duracao": "40 min de prática",
          "url": "https://mailu.io/latest/administration/",
          "aprendizado_chave": "Criação de usuários, definição de quotas, bloqueio de spam, consulta de logs.",
          "fonte_id": "F01"
        },
        {
          "titulo": "Configurando Thunderbird, Outlook, Gmail & Clientes Móveis",
          "tipo_midia": "Guia de Integração",
          "idioma": "PT-BR",
          "dica_traducao_ptbr": "Instruções passo a passo para os clientes mais populares.",
          "autor": "Mailu Community",
          "duracao": "50 min de prática",
          "url": "https://mailu.io/latest/clients/",
          "aprendizado_chave": "Configuração de IMAP (portas 143/993), SMTP (portas 587/465), validação de certificado SSL.",
          "fonte_id": "F03"
        }
      ]
    },
    {
      "fase_numero": 5,
      "titulo": "Fase 5: Monitoramento, Backup Automático & Operação em Produção",
      "tempo_estimado": "1h 15min",
      "objetivo": "Implementar rotina de backup, monitorar saúde do servidor (logs, disco, memória), configurar alertas e preparar desinstalação cirúrgica se necessário.",
      "recursos": [
        {
          "titulo": "Backup e Disaster Recovery de Servidor de Email",
          "tipo_midia": "Guia Técnico",
          "idioma": "PT-BR",
          "dica_traducao_ptbr": "Scripts prontos de backup em Bash para PostgreSQL e arquivos Mailu.",
          "autor": "Fábrica Universal Brasil",
          "duracao": "35 min de leitura",
          "url": "https://mailu.io/latest/administration/backups/",
          "aprendizado_chave": "Rotina diária de backup do banco PostgreSQL, armazenamento remoto com rsync/S3, testes de restauração.",
          "fonte_id": "F04"
        },
        {
          "titulo": "Monitoramento de Saúde: Logs, Alertas e Troubleshooting",
          "tipo_midia": "Código & Playbook",
          "idioma": "PT-BR",
          "dica_traducao_ptbr": "Comandos docker-compose logs para monitoramento em tempo real.",
          "autor": "Mailu Operations Guide",
          "duracao": "40 min de prática",
          "url": "https://mailu.io/latest/administration/troubleshooting/",
          "aprendizado_chave": "Interpretação de logs Postfix/Dovecot, diagnóstico de rejeições, limpeza de fila de emails.",
          "fonte_id": "F02"
        }
      ]
    }
  ]
}
