{
  "$schema": "../schemas/schema_trilha_aprendizado.json",
  "produto_foco": "Coqui XTTS-v2 (Clonagem de Voz Multilingue & TTS Neural)",
  "slug": "xtts-v2",
  "saas_origem": "elevenlabs",
  "tempo_total_estimado": "6 horas de imersao guiada",
  "fases": [
    {
      "fase_numero": 1,
      "titulo": "Fase 1: Fundamentos de Audio Neural, Transformers & TTS",
      "tempo_estimado": "1h 00min",
      "objetivo": "Compreender como a arquitetura autoregressiva do XTTS-v2 gera espectrogramas de mel e como o vocoder HiFi-GAN converte tensores em audio perceptivel.",
      "recursos": [
        {
          "titulo": "Coqui TTS Architecture & Deep Learning Foundations",
          "tipo_midia": "Documentacao Oficial",
          "idioma": "EN",
          "dica_traducao_ptbr": "Use a traducao automatica do navegador.",
          "autor": "Coqui AI Core Team",
          "duracao": "30 min",
          "url": "https://github.com/coqui-ai/TTS",
          "aprendizado_chave": "Pipeline acustico, tokenizacao fonetica e condicionamento por speaker latents.",
          "fonte_id": "F01"
        },
        {
          "titulo": "XTTS-v2 Model Card & Weights Overview",
          "tipo_midia": "Artigo Tecnico",
          "idioma": "EN",
          "dica_traducao_ptbr": "Consulte os exemplos de codigo em Python na pagina.",
          "autor": "Hugging Face Hub",
          "duracao": "30 min",
          "url": "https://huggingface.co/coqui/XTTS-v2",
          "aprendizado_chave": "Parametros de inferencia, idiomas suportados e benchmarks de naturalidade.",
          "fonte_id": "F02"
        }
      ]
    },
    {
      "fase_numero": 2,
      "titulo": "Fase 2: Setup de Producao na VPS com Aceleracao NVIDIA GPU",
      "tempo_estimado": "1h 30min",
      "objetivo": "Configurar container Docker oficial com suporte a CUDA 12+, persistencia de volumes e endpoints FastAPI.",
      "recursos": [
        {
          "titulo": "NVIDIA Container Toolkit & GPU Passthrough",
          "tipo_midia": "Tutorial Pratico",
          "idioma": "EN",
          "dica_traducao_ptbr": "Siga o passo a passo de instalacao do repositório NVIDIA.",
          "autor": "NVIDIA Documentation",
          "duracao": "45 min",
          "url": "https://docs.nvidia.com/datacenter/cloud-native/container-toolkit/",
          "aprendizado_chave": "Drivers CUDA, runtime NVIDIA no Docker e monitoramento com nvidia-smi.",
          "fonte_id": "F03"
        },
        {
          "titulo": "XTTS FastAPI Server Configuration",
          "tipo_midia": "Lab Interativo",
          "idioma": "EN",
          "dica_traducao_ptbr": "Teste chamadas via Swagger UI em http://localhost:5002/docs.",
          "autor": "Coqui Community",
          "duracao": "45 min",
          "url": "https://github.com/coqui-ai/TTS/wiki/FastAPI-Server",
          "aprendizado_chave": "Endpoints REST para sintese em lote, listagem de linguagens e upload de vozes.",
          "fonte_id": "F04"
        }
      ]
    },
    {
      "fase_numero": 3,
      "titulo": "Fase 3: Clonagem de Voz Zero-Shot com Amostras Reais",
      "tempo_estimado": "1h 00min",
      "objetivo": "Preparar arquivos WAV de referencia, limpar ruidos, normalizar volume e gerar clonagens de alta fidelidade.",
      "recursos": [
        {
          "titulo": "Voice Conditioning & Audio Preprocessing Best Practices",
          "tipo_midia": "Guia de Engenharia",
          "idioma": "EN",
          "dica_traducao_ptbr": "Verifique a secao de preparacao de dados no manual.",
          "autor": "Eren Golge et al.",
          "duracao": "30 min",
          "url": "https://arxiv.org/abs/2406.04904",
          "aprendizado_chave": "Normalizacao a -16 LUFS, amostragem a 24kHz e eliminacao de artefatos de compressao.",
          "fonte_id": "F05"
        }
      ]
    },
    {
      "fase_numero": 4,
      "titulo": "Fase 4: Streaming em Baixa Latencia & Integracao com LLMs",
      "tempo_estimado": "1h 30min",
      "objetivo": "Conectar o XTTS via WebSocket em tempo real para alimentar agentes conversacionais inteligentes com respostas de audio instantaneas.",
      "recursos": [
        {
          "titulo": "Chunked Audio Streaming Architecture",
          "tipo_midia": "Tutorial Pratico",
          "idioma": "EN",
          "dica_traducao_ptbr": "Implemente o client WebSocket em Python ou Node.js.",
          "autor": "Coqui Community",
          "duracao": "45 min",
          "url": "https://github.com/coqui-ai/TTS",
          "aprendizado_chave": "Time to First Byte (TTFB), chunks de audio de 200ms e duplex WebSockets.",
          "fonte_id": "F01"
        }
      ]
    },
    {
      "fase_numero": 5,
      "titulo": "Fase 5: Hardening, Monitoramento & Desinstalacao Cirurgica",
      "tempo_estimado": "1h 00min",
      "objetivo": "Configurar Nginx com SSL, implementar monitoramento de VRAM da GPU e validar os 4 passos de isolamento da VPS.",
      "recursos": [
        {
          "titulo": "Production Hardening & GPU Memory Management",
          "tipo_midia": "Playbook DevOps",
          "idioma": "EN",
          "dica_traducao_ptbr": "Consulte a secao de Desinstalacao Cirurgica no manual.",
          "autor": "Fabrica Universal AIDD",
          "duracao": "30 min",
          "url": "https://github.com/coqui-ai/TTS",
          "aprendizado_chave": "Proxy reverso Nginx, liberacao de VRAM e checklist de saude da VPS.",
          "fonte_id": "F04"
        }
      ]
    }
  ]
}