{
  "$schema": "../schemas/schema_trilha_aprendizado.json",
  "produto_foco": "Haraka",
  "slug": "haraka",
  "saas_origem": "locaweb-email",
  "tempo_total_estimado": "8 horas",
  "fases": [
    {
      "fase_numero": 1,
      "titulo": "Fase 1: Conceitos & Arquitetura SMTP",
      "tempo_estimado": "1h 30min",
      "objetivo": "Entender fundamentos de SMTP e diferenças entre MTA, MSA e Haraka",
      "recursos": [
        {
          "titulo": "O que é SMTP e Por Que Você Precisa de um Servidor Próprio",
          "tipo_midia": "Artigo Técnico",
          "idioma": "PT-BR",
          "dica_traducao_ptbr": "Conteúdo nativo em português",
          "autor": "Comunidade Email Open Source",
          "duracao": "45 min",
          "url": "https://www.rfc-editor.org/rfc/rfc5321.txt",
          "aprendizado_chave": "SMTP é padrão universal de troca de emails",
          "fonte_id": "F01"
        },
        {
          "titulo": "Arquitetura do Haraka em Node.js",
          "tipo_midia": "Documentação Oficial",
          "idioma": "EN",
          "dica_traducao_ptbr": "Use Chrome para traduzir",
          "autor": "Haraka Community",
          "duracao": "1h",
          "url": "https://haraka.github.io/",
          "aprendizado_chave": "Pipeline de hooks: validação, bloqueio, transformação",
          "fonte_id": "F02"
        },
        {
          "titulo": "Soberania de Email & LGPD",
          "tipo_midia": "Case Study",
          "idioma": "PT-BR",
          "dica_traducao_ptbr": "Análise em português",
          "autor": "Especialistas Compliance",
          "duracao": "30 min",
          "url": "https://www.gov.br/cidadania/pt-br/acesso-a-informacao/lgpd",
          "aprendizado_chave": "Custódia interna = compliance garantido",
          "fonte_id": "F03"
        }
      ]
    },
    {
      "fase_numero": 2,
      "titulo": "Fase 2: Instalação & Setup em VPS",
      "tempo_estimado": "2h",
      "objetivo": "Provisionar VPS, instalar Haraka, configurar plugins e receber primeiro email",
      "recursos": [
        {
          "titulo": "Escolher e Provisionar VPS",
          "tipo_midia": "Guia Comparativo",
          "idioma": "PT-BR",
          "dica_traducao_ptbr": "Análise de custos e performance",
          "autor": "DevOps Brasil",
          "duracao": "1h",
          "url": "https://contabo.com",
          "aprendizado_chave": "Contabo (barato), Hetzner (rápido), DigitalOcean (amigável)",
          "fonte_id": "F01"
        },
        {
          "titulo": "Instalação Haraka do Zero",
          "tipo_midia": "Tutorial",
          "idioma": "PT-BR/EN",
          "dica_traducao_ptbr": "Acompanhe com SSH aberto",
          "autor": "Haraka Documentation",
          "duracao": "1h hands-on",
          "url": "https://haraka.github.io/manual/Installation.html",
          "aprendizado_chave": "npm install -g haraka é tudo que você precisa",
          "fonte_id": "F02"
        },
        {
          "titulo": "Primeiro Email Teste",
          "tipo_midia": "Guia Prático",
          "idioma": "PT-BR",
          "dica_traducao_ptbr": "Screenshots em português",
          "autor": "Comunidade Brasil",
          "duracao": "30 min",
          "url": "https://mailtester.com",
          "aprendizado_chave": "Configure SMTP no cliente e teste",
          "fonte_id": "F03"
        }
      ]
    },
    {
      "fase_numero": 3,
      "titulo": "Fase 3: Antispam & Plugins Avançados",
      "tempo_estimado": "2h",
      "objetivo": "Instalar plugins de proteção contra spam com IA",
      "recursos": [
        {
          "titulo": "Plugins Haraka Essenciais",
          "tipo_midia": "Documentação Técnica",
          "idioma": "EN",
          "dica_traducao_ptbr": "Busque 'plugin-' no GitHub",
          "autor": "Haraka Maintainers",
          "duracao": "1h",
          "url": "https://github.com/haraka/Haraka/tree/master/plugins",
          "aprendizado_chave": "known_hosts, spamassassin, limit_concurrency",
          "fonte_id": "F01"
        },
        {
          "titulo": "Integração com Rspamd (IA Antispam)",
          "tipo_midia": "Tutorial",
          "idioma": "EN",
          "dica_traducao_ptbr": "Use Chrome para traduzir",
          "autor": "Rspamd Community",
          "duracao": "1h hands-on",
          "url": "https://rspamd.com/doc/workers/controller.html",
          "aprendizado_chave": "Bayes + Neural Networks > filtros simples",
          "fonte_id": "F02"
        }
      ]
    },
    {
      "fase_numero": 4,
      "titulo": "Fase 4: Segurança & Autenticação",
      "tempo_estimado": "1h 30min",
      "objetivo": "Configurar TLS, DKIM, SPF, DMARC, autenticação SASL",
      "recursos": [
        {
          "titulo": "SSL/TLS com LetsEncrypt",
          "tipo_midia": "Guia Prático",
          "idioma": "PT-BR",
          "dica_traducao_ptbr": "Instruções em português",
          "autor": "EFF Brasil",
          "duracao": "45 min",
          "url": "https://certbot.eff.org",
          "aprendizado_chave": "Certificados GRATUITOS com renovação automática",
          "fonte_id": "F01"
        },
        {
          "titulo": "DKIM, SPF & DMARC",
          "tipo_midia": "Guia Técnico",
          "idioma": "PT-BR",
          "dica_traducao_ptbr": "Explicação clara em português",
          "autor": "Especialistas Email",
          "duracao": "45 min",
          "url": "https://mxtoolbox.com/dmarc/",
          "aprendizado_chave": "Tripé de autenticação = 100% de autenticidade",
          "fonte_id": "F02"
        },
        {
          "titulo": "Autenticação SASL",
          "tipo_midia": "Tutorial",
          "idioma": "EN",
          "dica_traducao_ptbr": "Exemplos em YAML",
          "autor": "Haraka",
          "duracao": "30 min",
          "url": "https://haraka.github.io/plugins/auth/",
          "aprendizado_chave": "SASL força autenticação contra spam",
          "fonte_id": "F03"
        }
      ]
    },
    {
      "fase_numero": 5,
      "titulo": "Fase 5: Monitoramento & Operação Contínua",
      "tempo_estimado": "1h 30min",
      "objetivo": "Monitorar saúde, auditar logs, backup automático, respond incidentes",
      "recursos": [
        {
          "titulo": "Monitoramento em Tempo Real",
          "tipo_midia": "Tutorial DevOps",
          "idioma": "EN",
          "dica_traducao_ptbr": "Dashboards visuais",
          "autor": "Prometheus & DevOps",
          "duracao": "1h",
          "url": "https://prometheus.io/",
          "aprendizado_chave": "Prometheus + Grafana para métricas",
          "fonte_id": "F01"
        },
        {
          "titulo": "Leitura de Logs & Troubleshooting",
          "tipo_midia": "Guia Prático",
          "idioma": "PT-BR",
          "dica_traducao_ptbr": "Problemas reais em português",
          "autor": "Linux Tutores",
          "duracao": "30 min",
          "url": "tail -f /var/log/haraka/*.log",
          "aprendizado_chave": "Logs revelam tudo sobre o servidor",
          "fonte_id": "F02"
        },
        {
          "titulo": "Backup & Recuperação",
          "tipo_midia": "Script",
          "idioma": "PT-BR/Bash",
          "dica_traducao_ptbr": "Scripts prontos copyable",
          "autor": "DevOps",
          "duracao": "30 min",
          "url": "0 2 * * * /usr/local/bin/haraka_backup.sh",
          "aprendizado_chave": "Backup diário + teste mensal",
          "fonte_id": "F03"
        }
      ]
    }
  ]
}
