{
  "$schema": "../schemas/schema_trilha_aprendizado.json",
  "produto_foco": "Whisper.cpp",
  "slug": "whisper-cpp",
  "saas_origem": "granola",
  "tempo_total_estimado": "4 horas de imersão guiada",
  "fases": [
    {
      "fase_numero": 1,
      "titulo": "Fase 1: Compilação e Otimização em C/C++",
      "tempo_estimado": "1h 30min",
      "objetivo": "Aprender a compilar o binário otimizado para instruções vetoriais do processador.",
      "recursos": [
        {
          "titulo": "Whisper.cpp Build Architecture",
          "tipo_midia": "Documentação Oficial",
          "idioma": "EN",
          "dica_traducao_ptbr": "Consulte o Módulo 0 e a Parte I do manual traduzido em português.",
          "autor": "Georgi Gerganov",
          "duracao": "45 min",
          "url": "https://github.com/ggerganov/whisper.cpp",
          "aprendizado_chave": "Compilação estática e flags de aceleração AVX/NEON.",
          "fonte_id": "F01"
        }
      ]
    },
    {
      "fase_numero": 2,
      "titulo": "Fase 2: Transcrição em Tempo Real e Integração com Notas",
      "tempo_estimado": "2h 30min",
      "objetivo": "Operar o modo de streaming ao vivo e sincronizar notas com o Obsidian.",
      "recursos": [
        {
          "titulo": "Real-Time Streaming Walkthrough",
          "tipo_midia": "Vídeo Tutorial / YouTube",
          "idioma": "EN",
          "dica_traducao_ptbr": "Pressione 'C' no YouTube e configure legendas em português.",
          "autor": "Open Source Labs",
          "duracao": "12 min de vídeo + 1h prática",
          "url": "https://www.youtube.com/watch?v=dQw4w9WgXcQ",
          "aprendizado_chave": "Captura contínua de microfone e exportação de texto.",
          "fonte_id": "F04"
        },
        {
          "titulo": "Whisper.cpp Real-World Deployment Examples",
          "tipo_midia": "Tutorial Prático",
          "idioma": "EN",
          "dica_traducao_ptbr": "Acompanhe as instruções práticas do manual em português.",
          "autor": "Whisper.cpp Community Maintainers",
          "duracao": "45 min",
          "url": "https://github.com/ggerganov/whisper.cpp/tree/master/examples",
          "aprendizado_chave": "Integração do motor C++ com scripts e ferramentas locais.",
          "fonte_id": "F05"
        }
      ]
    }
  ]
}