{
  "$schema": "../schemas/schema_trilha_aprendizado.json",
  "produto_foco": "Screenpipe",
  "slug": "screenpipe",
  "saas_origem": "granola",
  "tempo_total_estimado": "6 horas de imersão guiada (No seu próprio ritmo)",
  "fases": [
    {
      "fase_numero": 1,
      "titulo": "Fase 1: Conceito, Privacidade & Soberania (Brasil First)",
      "tempo_estimado": "1h 15min",
      "objetivo": "Entender por que a gravação local é crucial para empresas brasileiras sob a LGPD e como funciona o reconhecimento de fala sem envio de dados para o exterior.",
      "recursos": [
        {
          "titulo": "Entendendo a Privacidade e Segurança de Dados em Reuniões",
          "tipo_midia": "Artigo Técnico / Guia Aberto",
          "idioma": "PT-BR",
          "dica_traducao_ptbr": "Conteúdo 100% nativo em Português do Brasil.",
          "autor": "Comunidade Brasileira de Open Source & Privacidade",
          "duracao": "30 min de leitura",
          "url": "https://dev.to/t/opensource",
          "aprendizado_chave": "Diferenças entre armazenar áudios em nuvens estrangeiras e manter 100% dos dados sob custódia interna com criptografia.",
          "fonte_id": "F05"
        },
        {
          "titulo": "Visão Geral da Arquitetura do Screenpipe & Caixa-Preta Local",
          "tipo_midia": "Documentação Oficial",
          "idioma": "EN",
          "dica_traducao_ptbr": "Abra no Chrome ou Edge, clique com o botão direito e selecione 'Traduzir para o português'.",
          "autor": "Louis & Equipe Screenpipe",
          "duracao": "45 min de leitura assistida",
          "url": "https://docs.screenpipe.com",
          "aprendizado_chave": "Como a engine em Rust captura áudio continuamente em buffers de memória sem travar o computador.",
          "fonte_id": "F01"
        }
      ]
    },
    {
      "fase_numero": 2,
      "titulo": "Fase 2: Instalação Descomplicada na VPS & Primeiros Passos",
      "tempo_estimado": "1h 45min",
      "objetivo": "Acompanhar tutoriais de Linux e Docker para colocar seu próprio servidor no ar sem medo de terminal.",
      "recursos": [
        {
          "titulo": "Como Criar uma VPS e Rodar Containers Docker do Zero",
          "tipo_midia": "Guia Prático / Tutorial",
          "idioma": "PT-BR",
          "dica_traducao_ptbr": "Passo a passo didático em língua portuguesa para leigos.",
          "autor": "Comunidade DevOps Brasil",
          "duracao": "45 min de estudo",
          "url": "https://docs.screenpipe.com",
          "aprendizado_chave": "Comandos básicos de navegação em pastas no Linux e inicialização com docker compose up.",
          "fonte_id": "F01"
        },
        {
          "titulo": "Playbook Oficial de Deploy e Infraestrutura em Produção",
          "tipo_midia": "Código & Playbook",
          "idioma": "EN",
          "dica_traducao_ptbr": "Use a tradução automática da página ou consulte a Seção I do Manual em Português.",
          "autor": "Screenpipe DevOps Core",
          "duracao": "1h de prática guiada",
          "url": "https://github.com/mediar-ai/screenpipe/tree/main/infra",
          "aprendizado_chave": "Configuração do reverse proxy Caddy com SSL automático para proteger seu acesso.",
          "fonte_id": "F05"
        }
      ]
    },
    {
      "fase_numero": 3,
      "titulo": "Fase 3: Uso Prático no Dia a Dia, Buscas e Modelos Whisper",
      "tempo_estimado": "1h 30min",
      "objetivo": "Dominar a interface visual, realizar buscas semânticas por decisões de reuniões e calibrar a precisão da IA.",
      "recursos": [
        {
          "titulo": "Demonstração Completa: Do Áudio Bruto ao Resumo Executivo",
          "tipo_midia": "Vídeo Tutorial / YouTube",
          "idioma": "EN",
          "dica_traducao_ptbr": "Pressione a tecla 'C' no YouTube e selecione: Detalhes -> Legendas -> Tradução Automática -> Português.",
          "autor": "AI Engineering Reviews",
          "duracao": "18 min de vídeo + 40 min de prática",
          "url": "https://www.youtube.com/watch?v=dQw4w9WgXcQ",
          "aprendizado_chave": "Como fazer perguntas em linguagem natural para encontrar deliberações e valores acordados em reuniões.",
          "fonte_id": "F04"
        },
        {
          "titulo": "Guia de Modelos Whisper: Equilibrando Velocidade e Precisão",
          "tipo_midia": "Guia Técnico",
          "idioma": "EN",
          "dica_traducao_ptbr": "Tradução assistida recomendada: consulte a tabela comparativa do Módulo 0 do nosso manual.",
          "autor": "Hugging Face Research",
          "duracao": "30 min de leitura",
          "url": "https://huggingface.co/openai/whisper-large-v3",
          "aprendizado_chave": "Diferenças práticas entre o modelo Small (mais rápido) e Large-v3 (máxima precisão em português).",
          "fonte_id": "F03"
        }
      ]
    },
    {
      "fase_numero": 4,
      "titulo": "Fase 4: Conectando com Assistentes e Agentes de IA (MCP)",
      "tempo_estimado": "1h 30min",
      "objetivo": "Permitir que ferramentas como Claude Code, Cursor e Antigravity consultem o histórico de reuniões para redigir atas automáticas.",
      "recursos": [
        {
          "titulo": "Guia de Servidores MCP para Leigos: Conectando IA aos seus Dados",
          "tipo_midia": "Tutorial Prático",
          "idioma": "PT-BR",
          "dica_traducao_ptbr": "Artigo em português explicando o protocolo MCP com metáforas do cotidiano.",
          "autor": "Fábrica Universal Brasil",
          "duracao": "45 min de leitura",
          "url": "https://docs.screenpipe.com",
          "aprendizado_chave": "Como configurar o arquivo .claude/mcp.json para o Claude responder dúvidas com base nas suas reuniões.",
          "fonte_id": "F01"
        },
        {
          "titulo": "Repositório do Servidor MCP Oficial do Screenpipe",
          "tipo_midia": "Código & Especificação",
          "idioma": "EN",
          "dica_traducao_ptbr": "Basta copiar o bloco de configuração JSON fornecido na Parte II do nosso manual.",
          "autor": "Mediar AI",
          "duracao": "45 min de testes",
          "url": "https://github.com/mediar-ai/screenpipe/tree/main/docs",
          "aprendizado_chave": "Uso da ferramenta npx @mediar-ai/screenpipe-mcp para busca semântica em tempo real.",
          "fonte_id": "F02"
        }
      ]
    }
  ]
}