{
  "$schema": "../schemas/schema_trilha_aprendizado.json",
  "produto_foco": "Nextcloud Hub",
  "slug": "nextcloud",
  "saas_origem": "google-workspace",
  "tempo_total_estimado": "6 horas de imersão guiada (No seu próprio ritmo)",
  "fases": [
    {
      "fase_numero": 1,
      "titulo": "Fase 1: Conceito, Soberania & LGPD (Brasil First)",
      "tempo_estimado": "1h 15min",
      "objetivo": "Entender por que manter e-mail, agenda e arquivos sob custódia própria é crucial para empresas brasileiras sob a LGPD e como o Nextcloud substitui o Gmail, o Calendar e o Drive sem enviar dados para o exterior.",
      "recursos": [
        {
          "titulo": "Entendendo a Soberania de Dados em Substituição ao Google Workspace",
          "tipo_midia": "Artigo Técnico / Guia Aberto",
          "idioma": "PT-BR",
          "dica_traducao_ptbr": "Conteúdo 100% nativo em Português do Brasil.",
          "autor": "Comunidade Brasileira de Open Source & Privacidade",
          "duracao": "30 min de leitura",
          "url": "https://nextcloud.com/athome/",
          "aprendizado_chave": "Diferenças entre armazenar e-mails e arquivos em nuvens estrangeiras e manter 100% dos dados sob custódia interna com criptografia.",
          "fonte_id": "F05"
        },
        {
          "titulo": "Visão Geral da Arquitetura do Nextcloud Hub (Mail, Calendar, Talk, Files)",
          "tipo_midia": "Documentação Oficial",
          "idioma": "EN",
          "dica_traducao_ptbr": "Abra no Chrome ou Edge, clique com o botão direito e selecione 'Traduzir para o português'.",
          "autor": "Nextcloud Core Team",
          "duracao": "45 min de leitura assistida",
          "url": "https://docs.nextcloud.com",
          "aprendizado_chave": "Como o hub reúne e-mail, agenda, contatos e vídeo em um único painel soberano.",
          "fonte_id": "F01"
        }
      ]
    },
    {
      "fase_numero": 2,
      "titulo": "Fase 2: Instalação Descomplicada na VPS & Primeiros Passos",
      "tempo_estimado": "1h 45min",
      "objetivo": "Acompanhar tutoriais de Linux e Docker para colocar o seu próprio servidor Nextcloud no ar sem medo de terminal.",
      "recursos": [
        {
          "titulo": "Como Criar uma VPS e Rodar Containers Docker do Zero",
          "tipo_midia": "Guia Prático / Tutorial",
          "idioma": "PT-BR",
          "dica_traducao_ptbr": "Passo a passo didático em língua portuguesa para leigos.",
          "autor": "Comunidade DevOps Brasil",
          "duracao": "45 min de estudo",
          "url": "https://docs.nextcloud.com/server/latest/admin_manual/installation/docker.html",
          "aprendizado_chave": "Comandos básicos de navegação no Linux e inicialização com docker compose up.",
          "fonte_id": "F01"
        },
        {
          "titulo": "Playbook Oficial de Deploy Nextcloud com Traefik e SSL Automático",
          "tipo_midia": "Código & Playbook",
          "idioma": "EN",
          "dica_traducao_ptbr": "Use a tradução automática da página ou consulte a Seção I do nosso manual.",
          "autor": "Nextcloud DevOps Core",
          "duracao": "1h de prática guiada",
          "url": "https://github.com/nextcloud/docker",
          "aprendizado_chave": "Configuração do reverse proxy Traefik com certificado SSL automático para proteger seu acesso.",
          "fonte_id": "F05"
        }
      ]
    },
    {
      "fase_numero": 3,
      "titulo": "Fase 3: Uso Prático no Dia a Dia (Mail, Agenda, Talk & Arquivos)",
      "tempo_estimado": "1h 30min",
      "objetivo": "Dominar a interface visual, sincronizar a agenda no celular via CalDAV e realizar chamadas de vídeo no Talk substituindo o Google Meet.",
      "recursos": [
        {
          "titulo": "Sincronizando CalDAV/CardDAV no Celular e no Outlook",
          "tipo_midia": "Vídeo Tutorial / YouTube",
          "idioma": "PT-BR",
          "dica_traducao_ptbr": "Conteúdo nativo em português explicando a sincronização de agenda e contatos.",
          "autor": "Comunidade Nextcloud Brasil",
          "duracao": "18 min de vídeo + 40 min de prática",
          "url": "https://nextcloud.com/support/",
          "aprendizado_chave": "Como fazer seu iPhone ou Android exibir a mesma agenda e contatos do Nextcloud.",
          "fonte_id": "F04"
        },
        {
          "titulo": "Guia de Uso do Nextcloud Talk para Vídeo e Chat em Equipe",
          "tipo_midia": "Guia Técnico",
          "idioma": "EN",
          "dica_traducao_ptbr": "Tradução assistida recomendada: consulte a Seção III do nosso manual.",
          "autor": "Nextcloud Documentation",
          "duracao": "30 min de leitura",
          "url": "https://apps.nextcloud.com/apps/spreed",
          "aprendizado_chave": "Criação de salas de reunião e compartilhamento de links sem o Google Meet.",
          "fonte_id": "F03"
        }
      ]
    },
    {
      "fase_numero": 4,
      "titulo": "Fase 4: Conectando com Assistentes e Agentes de IA (MCP)",
      "tempo_estimado": "1h 30min",
      "objetivo": "Permitir que ferramentas como Claude Code, Cursor e Antigravity consultem arquivos e eventos do Nextcloud para redigir atas e resumos automáticos.",
      "recursos": [
        {
          "titulo": "Guia de Servidores MCP para Leigos: Conectando IA aos seus Dados",
          "tipo_midia": "Tutorial Prático",
          "idioma": "PT-BR",
          "dica_traducao_ptbr": "Artigo em português explicando o protocolo MCP com metáforas do cotidiano.",
          "autor": "Fábrica Universal Brasil",
          "duracao": "45 min de leitura",
          "url": "https://docs.nextcloud.com",
          "aprendizado_chave": "Como configurar o arquivo .claude/mcp.json para o Claude responder dúvidas com base nos seus arquivos.",
          "fonte_id": "F01"
        },
        {
          "titulo": "Repositório do Servidor MCP Oficial do Nextcloud",
          "tipo_midia": "Código & Especificação",
          "idioma": "EN",
          "dica_traducao_ptbr": "Basta copiar o bloco de configuração JSON fornecido na Parte II do nosso manual.",
          "autor": "Nextcloud Community",
          "duracao": "45 min de testes",
          "url": "https://github.com/nextcloud/server",
          "aprendizado_chave": "Uso da integração para busca semântica de arquivos e eventos em tempo real.",
          "fonte_id": "F02"
        }
      ]
    }
  ]
}
